<?xml version="1.0"?>
<!DOCTYPE attack_pattern PUBLIC "-//CAIRIS//DTD ATTACKPATTERN 1.0//EN" "https://cairis.org/dtd/attack_pattern.dtd">

<!-- 
  Licensed to the Apache Software Foundation (ASF) under one
  or more contributor license agreements.  See the NOTICE file
  distributed with this work for additional information
  regarding copyright ownership.  The ASF licenses this file
  to you under the Apache License, Version 2.0 (the
  "License"); you may not use this file except in compliance
  with the License.  You may obtain a copy of the License at

  http://www.apache.org/licenses/LICENSE-2.0

  Unless required by applicable law or agreed to in writing,
  software distributed under the License is distributed on an
  "AS IS" BASIS, WITHOUT WARRANTIES OR CONDITIONS OF ANY
  KIND, either express or implied.  See the License for the
  specific language governing permissions and limitations
  under the License.
-->


<attack_pattern name="Request footprinting" likelihood="Occasional" severity="Critical"> 
  <intent>Glean an understanding of what resources are available on a device by eavesdropping on requests.</intent> 
  <motivation goal="confidentiality" value="Low"> 
    <description>Ethan wants to get a better understanding of what resources are under policy control.</description>
  </motivation>
  <applicability environment="Complete" />
  <structure attack="Network Eavesdropping" exploit="Missing XML Validation" /> 
  <participant name="Ethan">
    <motive name="System resource theft" />
    <responsibility name="Technology" value="Medium" />
    <responsibility name="Software" value="Medium" />
    <responsibility name="Knowledge/Methods" value="Medium" />
  </participant>
  <collaboration>
    <target name="Access Requestor" /> 
    <exploit name="Access Request" />
  </collaboration>
  <consequences>Impact of attack</consequences>
  <implementation>This scenario describes how Ethan carries out request footprinting</implementation>
  <known_uses>None</known_uses>
  <related_patterns>None</related_patterns>
</attack_pattern>
